::

  kaz@kaz-VirtualBox:~/src/git/camera/pandac$ lsusb
  Bus 002 Device 001: ID 1d6b:0003 Linux Foundation 3.0 root hub
  Bus 001 Device 003: ID 80ee:0030 VirtualBox 
  Bus 001 Device 002: ID 80ee:0021 VirtualBox USB Tablet
  Bus 001 Device 001: ID 1d6b:0002 Linux Foundation 2.0 root hub

  kaz@kaz-VirtualBox:~/src/git/camera/pandac$ lsusb -s 001:003 -v

  Bus 001 Device 003: ID 80ee:0030 VirtualBox 
  Couldn't open device, some information will be missing
  Device Descriptor:
    bLength                18
    bDescriptorType         1
    bcdUSB               2.00
    bDeviceClass          239 Miscellaneous Device
    bDeviceSubClass         2 ?
    bDeviceProtocol         1 Interface Association
    bMaxPacketSize0        16
    idVendor           0x80ee VirtualBox
    idProduct          0x0030 
    bcdDevice            1.00
    iManufacturer           1 
    iProduct                2 
    iSerial                 3 
    bNumConfigurations      1
    Configuration Descriptor:
      bLength                 9
      bDescriptorType         2
      wTotalLength          487
      bNumInterfaces          2
      bConfigurationValue     1
      iConfiguration          0 
      bmAttributes         0x80
        (Bus Powered)
      MaxPower              500mA
      Interface Association:
        bLength                 8
        bDescriptorType        11
        bFirstInterface         0
        bInterfaceCount         2
        bFunctionClass         14 Video
        bFunctionSubClass       3 Video Interface Collection
        bFunctionProtocol       0 
        iFunction               2 
      Interface Descriptor:
        bLength                 9
        bDescriptorType         4
        bInterfaceNumber        0
        bAlternateSetting       0
        bNumEndpoints           1
        bInterfaceClass        14 Video
        bInterfaceSubClass      1 Video Control
        bInterfaceProtocol      0 
        iInterface              2 
        VideoControl Interface Descriptor:
          bLength                13
          bDescriptorType        36
          bDescriptorSubtype      1 (HEADER)
          bcdUVC               1.00
          wTotalLength           52
          dwClockFrequency        1.000000MHz
          bInCollection           1
          baInterfaceNr( 0)       1
        VideoControl Interface Descriptor:
          bLength                18
          bDescriptorType        36
          bDescriptorSubtype      2 (INPUT_TERMINAL)
          bTerminalID             1
          wTerminalType      0x0201 Camera Sensor
          bAssocTerminal          0
          iTerminal               0 
          wObjectiveFocalLengthMin      0
          wObjectiveFocalLengthMax      0
          wOcularFocalLength            0
          bControlSize                  3
          bmControls           0x00000000
        VideoControl Interface Descriptor:
          bLength                12
          bDescriptorType        36
          bDescriptorSubtype      5 (PROCESSING_UNIT)
        Warning: Descriptor too short
          bUnitID                 2
          bSourceID               1
          wMaxMultiplier          0
          bControlSize            3
          bmControls     0x00000001
            Brightness
          iProcessing             0 
          bmVideoStandards     0x 9
            None
            SECAM - 625/50
        VideoControl Interface Descriptor:
          bLength                 9
          bDescriptorType        36
          bDescriptorSubtype      3 (OUTPUT_TERMINAL)
          bTerminalID             3
          wTerminalType      0x0101 USB Streaming
          bAssocTerminal          0
          bSourceID               2
          iTerminal               0 
        Endpoint Descriptor:
          bLength                 7
          bDescriptorType         5
          bEndpointAddress     0x81  EP 1 IN
          bmAttributes            3
            Transfer Type            Interrupt
            Synch Type               None
            Usage Type               Data
          wMaxPacketSize     0x0010  1x 16 bytes
          bInterval              64
      Interface Descriptor:
        bLength                 9
        bDescriptorType         4
        bInterfaceNumber        1
        bAlternateSetting       0
        bNumEndpoints           1
        bInterfaceClass        14 Video
        bInterfaceSubClass      2 Video Streaming
        bInterfaceProtocol      0 
        iInterface              0 
        VideoStreaming Interface Descriptor:
          bLength                            14
          bDescriptorType                    36
          bDescriptorSubtype                  1 (INPUT_HEADER)
          bNumFormats                         1
          wTotalLength                      381
          bEndPointAddress                  130
          bmInfo                              1
          bTerminalLink                       3
          bStillCaptureMethod                 0
          bTriggerSupport                     0
          bTriggerUsage                       0
          bControlSize                        1
          bmaControls( 0)                    11
        VideoStreaming Interface Descriptor:
          bLength                            11
          bDescriptorType                    36
          bDescriptorSubtype                  6 (FORMAT_MJPEG)
          bFormatIndex                        1
          bNumFrameDescriptors                7
          bFlags                              1
            Fixed-size samples: Yes
          bDefaultFrameIndex                  1
          bAspectRatioX                       0
          bAspectRatioY                       0
          bmInterlaceFlags                 0x00
            Interlaced stream or variable: No
            Fields per frame: 1 fields
            Field 1 first: No
            Field pattern: Field 1 only
            bCopyProtect                      0
        VideoStreaming Interface Descriptor:
          bLength                            50
          bDescriptorType                    36
          bDescriptorSubtype                  7 (FRAME_MJPEG)
          bFrameIndex                         1
          bmCapabilities                   0x00
            Still image unsupported
          wWidth                            640
          wHeight                           360
          dwMinBitRate                 18432000
          dwMaxBitRate                110592000
          dwMaxVideoFrameBufferSize      460800
          dwDefaultFrameInterval         333333
          bFrameIntervalType                  6
          dwFrameInterval( 0)            333333
          dwFrameInterval( 1)            400000
          dwFrameInterval( 2)            500000
          dwFrameInterval( 3)            666666
          dwFrameInterval( 4)           1000000
          dwFrameInterval( 5)           2000000
        VideoStreaming Interface Descriptor:
          bLength                            50
          bDescriptorType                    36
          bDescriptorSubtype                  7 (FRAME_MJPEG)
          bFrameIndex                         2
          bmCapabilities                   0x00
            Still image unsupported
          wWidth                           1920
          wHeight                          1080
          dwMinBitRate                165888000
          dwMaxBitRate                995328000
          dwMaxVideoFrameBufferSize     4147200
          dwDefaultFrameInterval         333333
          bFrameIntervalType                  6
          dwFrameInterval( 0)            333333
          dwFrameInterval( 1)            400000
          dwFrameInterval( 2)            500000
          dwFrameInterval( 3)            666666
          dwFrameInterval( 4)           1000000
          dwFrameInterval( 5)           2000000
        VideoStreaming Interface Descriptor:
          bLength                            50
          bDescriptorType                    36
          bDescriptorSubtype                  7 (FRAME_MJPEG)
          bFrameIndex                         3
          bmCapabilities                   0x00
            Still image unsupported
          wWidth                           1280
          wHeight                           720
          dwMinBitRate                 73728000
          dwMaxBitRate                442368000
          dwMaxVideoFrameBufferSize     1843200
          dwDefaultFrameInterval         333333
          bFrameIntervalType                  6
          dwFrameInterval( 0)            333333
          dwFrameInterval( 1)            400000
          dwFrameInterval( 2)            500000
          dwFrameInterval( 3)            666666
          dwFrameInterval( 4)           1000000
          dwFrameInterval( 5)           2000000
        VideoStreaming Interface Descriptor:
          bLength                            50
          bDescriptorType                    36
          bDescriptorSubtype                  7 (FRAME_MJPEG)
          bFrameIndex                         4
          bmCapabilities                   0x00
            Still image unsupported
          wWidth                            640
          wHeight                           480
          dwMinBitRate                 24576000
          dwMaxBitRate                147456000
          dwMaxVideoFrameBufferSize      614400
          dwDefaultFrameInterval         333333
          bFrameIntervalType                  6
          dwFrameInterval( 0)            333333
          dwFrameInterval( 1)            400000
          dwFrameInterval( 2)            500000
          dwFrameInterval( 3)            666666
          dwFrameInterval( 4)           1000000
          dwFrameInterval( 5)           2000000
        VideoStreaming Interface Descriptor:
          bLength                            50
          bDescriptorType                    36
          bDescriptorSubtype                  7 (FRAME_MJPEG)
          bFrameIndex                         5
          bmCapabilities                   0x00
            Still image unsupported
          wWidth                            352
          wHeight                           288
          dwMinBitRate                  8110080
          dwMaxBitRate                 48660480
          dwMaxVideoFrameBufferSize      202752
          dwDefaultFrameInterval         333333
          bFrameIntervalType                  6
          dwFrameInterval( 0)            333333
          dwFrameInterval( 1)            400000
          dwFrameInterval( 2)            500000
          dwFrameInterval( 3)            666666
          dwFrameInterval( 4)           1000000
          dwFrameInterval( 5)           2000000
        VideoStreaming Interface Descriptor:
          bLength                            50
          bDescriptorType                    36
          bDescriptorSubtype                  7 (FRAME_MJPEG)
          bFrameIndex                         6
          bmCapabilities                   0x00
            Still image unsupported
          wWidth                            320
          wHeight                           240
          dwMinBitRate                  6144000
          dwMaxBitRate                 36864000
          dwMaxVideoFrameBufferSize      153600
          dwDefaultFrameInterval         333333
          bFrameIntervalType                  6
          dwFrameInterval( 0)            333333
          dwFrameInterval( 1)            400000
          dwFrameInterval( 2)            500000
          dwFrameInterval( 3)            666666
          dwFrameInterval( 4)           1000000
          dwFrameInterval( 5)           2000000
        VideoStreaming Interface Descriptor:
          bLength                            50
          bDescriptorType                    36
          bDescriptorSubtype                  7 (FRAME_MJPEG)
          bFrameIndex                         7
          bmCapabilities                   0x00
            Still image unsupported
          wWidth                            176
          wHeight                           144
          dwMinBitRate                  2027520
          dwMaxBitRate                 12165120
          dwMaxVideoFrameBufferSize       50688
          dwDefaultFrameInterval         333333
          bFrameIntervalType                  6
          dwFrameInterval( 0)            333333
          dwFrameInterval( 1)            400000
          dwFrameInterval( 2)            500000
          dwFrameInterval( 3)            666666
          dwFrameInterval( 4)           1000000
          dwFrameInterval( 5)           2000000
        VideoStreaming Interface Descriptor:
          bLength                             6
          bDescriptorType                    36
          bDescriptorSubtype                 13 (COLORFORMAT)
          bColorPrimaries                     1 (BT.709,sRGB)
          bTransferCharacteristics            1 (BT.709)
          bMatrixCoefficients                 4 (SMPTE 170M (BT.601))
        Endpoint Descriptor:
          bLength                 7
          bDescriptorType         5
          bEndpointAddress     0x82  EP 2 IN
          bmAttributes            2
            Transfer Type            Bulk
            Synch Type               None
            Usage Type               Data
          wMaxPacketSize     0x0040  1x 64 bytes
          bInterval               0
